<?xml version="1.0" encoding="utf-8"?>
<!DOCTYPE list SYSTEM "tree.dtd">
<!--Create by VISTALL. Full reworked to Glory of Destruction by Bonux. -->
<list>
	<normal_skill_tree>
		<class id="42"> <!--shillien_oracle-->
			<skill id="146" level="5" cost="160" name="Anti Magic" min_level="20"/>
			<skill id="146" level="6" cost="160" name="Anti Magic" min_level="20"/>
			<skill id="146" level="7" cost="320" name="Anti Magic" min_level="25"/>
			<skill id="146" level="8" cost="320" name="Anti Magic" min_level="25"/>
			<skill id="146" level="9" cost="580" name="Anti Magic" min_level="30"/>
			<skill id="146" level="10" cost="580" name="Anti Magic" min_level="30"/>
			<skill id="146" level="11" cost="1200" name="Anti Magic" min_level="35"/>
			<skill id="146" level="12" cost="1200" name="Anti Magic" min_level="35"/>
			<skill id="164" level="1" cost="330" name="Quick Recycle" min_level="20"/>
			<skill id="164" level="2" cost="1200" name="Quick Recycle" min_level="30"/>
			<skill id="212" level="1" cost="2300" name="Fast HP Recovery" min_level="35"/>
			<skill id="213" level="1" cost="330" name="Boost Mana" min_level="20"/>
			<skill id="213" level="2" cost="1200" name="Boost Mana" min_level="30"/>
			<skill id="228" level="1" cost="650" name="Fast Spell Casting" min_level="25"/>
			<skill id="229" level="1" cost="650" name="Fast Mana Recovery" min_level="25"/>
			<skill id="229" level="2" cost="2300" name="Fast Mana Recovery" min_level="35"/>
			<skill id="235" level="1" cost="160" name="Robe Mastery" min_level="20"/>
			<skill id="235" level="2" cost="160" name="Robe Mastery" min_level="20"/>
			<skill id="235" level="3" cost="320" name="Robe Mastery" min_level="25"/>
			<skill id="235" level="4" cost="320" name="Robe Mastery" min_level="25"/>
			<skill id="235" level="5" cost="580" name="Robe Mastery" min_level="30"/>
			<skill id="235" level="6" cost="580" name="Robe Mastery" min_level="30"/>
			<skill id="235" level="7" cost="1200" name="Robe Mastery" min_level="35"/>
			<skill id="235" level="8" cost="1200" name="Robe Mastery" min_level="35"/>
			<skill id="236" level="1" cost="160" name="Light Armor Mastery" min_level="20"/>
			<skill id="236" level="2" cost="160" name="Light Armor Mastery" min_level="20"/>
			<skill id="236" level="3" cost="320" name="Light Armor Mastery" min_level="25"/>
			<skill id="236" level="4" cost="320" name="Light Armor Mastery" min_level="25"/>
			<skill id="236" level="5" cost="580" name="Light Armor Mastery" min_level="30"/>
			<skill id="236" level="6" cost="580" name="Light Armor Mastery" min_level="30"/>
			<skill id="236" level="7" cost="1200" name="Light Armor Mastery" min_level="35"/>
			<skill id="236" level="8" cost="1200" name="Light Armor Mastery" min_level="35"/>
			<skill id="249" level="3" cost="330" name="Weapon Mastery" min_level="20"/>
			<skill id="249" level="4" cost="320" name="Weapon Mastery" min_level="25"/>
			<skill id="249" level="5" cost="320" name="Weapon Mastery" min_level="25"/>
			<skill id="249" level="6" cost="580" name="Weapon Mastery" min_level="30"/>
			<skill id="249" level="7" cost="580" name="Weapon Mastery" min_level="30"/>
			<skill id="249" level="8" cost="1200" name="Weapon Mastery" min_level="35"/>
			<skill id="249" level="9" cost="1200" name="Weapon Mastery" min_level="35"/>
			<skill id="1011" level="7" cost="110" name="Heal" min_level="20"/>
			<skill id="1011" level="8" cost="110" name="Heal" min_level="20"/>
			<skill id="1011" level="9" cost="110" name="Heal" min_level="20"/>
			<skill id="1011" level="10" cost="220" name="Heal" min_level="25"/>
			<skill id="1011" level="11" cost="220" name="Heal" min_level="25"/>
			<skill id="1011" level="12" cost="220" name="Heal" min_level="25"/>
			<skill id="1011" level="13" cost="390" name="Heal" min_level="30"/>
			<skill id="1011" level="14" cost="390" name="Heal" min_level="30"/>
			<skill id="1011" level="15" cost="390" name="Heal" min_level="30"/>
			<skill id="1011" level="16" cost="770" name="Heal" min_level="35"/>
			<skill id="1011" level="17" cost="770" name="Heal" min_level="35"/>
			<skill id="1011" level="18" cost="770" name="Heal" min_level="35"/>
			<skill id="1012" level="2" cost="2300" name="Cure Poison" min_level="35"/>
			<skill id="1013" level="1" cost="580" name="Recharge" min_level="30"/>
			<skill id="1013" level="2" cost="580" name="Recharge" min_level="30"/>
			<skill id="1013" level="3" cost="1200" name="Recharge" min_level="35"/>
			<skill id="1013" level="4" cost="1200" name="Recharge" min_level="35"/>
			<skill id="1015" level="4" cost="110" name="Battle Heal" min_level="20"/>
			<skill id="1015" level="5" cost="110" name="Battle Heal" min_level="20"/>
			<skill id="1015" level="6" cost="110" name="Battle Heal" min_level="20"/>
			<skill id="1015" level="7" cost="220" name="Battle Heal" min_level="25"/>
			<skill id="1015" level="8" cost="220" name="Battle Heal" min_level="25"/>
			<skill id="1015" level="9" cost="220" name="Battle Heal" min_level="25"/>
			<skill id="1015" level="10" cost="390" name="Battle Heal" min_level="30"/>
			<skill id="1015" level="11" cost="390" name="Battle Heal" min_level="30"/>
			<skill id="1015" level="12" cost="390" name="Battle Heal" min_level="30"/>
			<skill id="1015" level="13" cost="770" name="Battle Heal" min_level="35"/>
			<skill id="1015" level="14" cost="770" name="Battle Heal" min_level="35"/>
			<skill id="1015" level="15" cost="770" name="Battle Heal" min_level="35"/>
			<skill id="1016" level="1" cost="330" name="Resurrection" min_level="20"/>
			<skill id="1016" level="2" cost="1200" name="Resurrection" min_level="30"/>
			<skill id="1027" level="4" cost="110" name="Group Heal" min_level="20"/>
			<skill id="1027" level="5" cost="110" name="Group Heal" min_level="20"/>
			<skill id="1027" level="6" cost="110" name="Group Heal" min_level="20"/>
			<skill id="1027" level="7" cost="220" name="Group Heal" min_level="25"/>
			<skill id="1027" level="8" cost="220" name="Group Heal" min_level="25"/>
			<skill id="1027" level="9" cost="220" name="Group Heal" min_level="25"/>
			<skill id="1027" level="10" cost="390" name="Group Heal" min_level="30"/>
			<skill id="1027" level="11" cost="390" name="Group Heal" min_level="30"/>
			<skill id="1027" level="12" cost="390" name="Group Heal" min_level="30"/>
			<skill id="1027" level="13" cost="770" name="Group Heal" min_level="35"/>
			<skill id="1027" level="14" cost="770" name="Group Heal" min_level="35"/>
			<skill id="1027" level="15" cost="770" name="Group Heal" min_level="35"/>
			<skill id="1031" level="1" cost="160" name="Disrupt Undead" min_level="20"/>
			<skill id="1031" level="2" cost="160" name="Disrupt Undead" min_level="20"/>
			<skill id="1031" level="3" cost="320" name="Disrupt Undead" min_level="25"/>
			<skill id="1031" level="4" cost="320" name="Disrupt Undead" min_level="25"/>
			<skill id="1031" level="5" cost="580" name="Disrupt Undead" min_level="30"/>
			<skill id="1031" level="6" cost="580" name="Disrupt Undead" min_level="30"/>
			<skill id="1031" level="7" cost="1200" name="Disrupt Undead" min_level="35"/>
			<skill id="1031" level="8" cost="1200" name="Disrupt Undead" min_level="35"/>
			<skill id="1035" level="1" cost="650" name="Mental Shield" min_level="25"/>
			<skill id="1040" level="2" cost="650" name="Shield" min_level="25"/>
			<skill id="1059" level="1" cost="650" name="Empower" min_level="25"/>
			<skill id="1068" level="2" cost="330" name="Might" min_level="20"/>
			<skill id="1069" level="1" cost="220" name="Sleep" min_level="25"/>
			<skill id="1069" level="2" cost="220" name="Sleep" min_level="25"/>
			<skill id="1069" level="3" cost="220" name="Sleep" min_level="25"/>
			<skill id="1069" level="4" cost="390" name="Sleep" min_level="30"/>
			<skill id="1069" level="5" cost="390" name="Sleep" min_level="30"/>
			<skill id="1069" level="6" cost="390" name="Sleep" min_level="30"/>
			<skill id="1069" level="7" cost="770" name="Sleep" min_level="35"/>
			<skill id="1069" level="8" cost="770" name="Sleep" min_level="35"/>
			<skill id="1069" level="9" cost="770" name="Sleep" min_level="35"/>
			<skill id="1073" level="1" cost="330" name="Kiss of Eva" min_level="20"/>
			<skill id="1077" level="1" cost="650" name="Focus" min_level="25"/>
			<skill id="1078" level="1" cost="330" name="Concentration" min_level="20"/>
			<skill id="1078" level="2" cost="1200" name="Concentration" min_level="30"/>
			<skill id="1189" level="1" cost="2300" name="Resist Wind" min_level="35"/>
			<skill id="1201" level="1" cost="220" name="Dryad Root" min_level="25"/>
			<skill id="1201" level="2" cost="220" name="Dryad Root" min_level="25"/>
			<skill id="1201" level="3" cost="220" name="Dryad Root" min_level="25"/>
			<skill id="1201" level="4" cost="390" name="Dryad Root" min_level="30"/>
			<skill id="1201" level="5" cost="390" name="Dryad Root" min_level="30"/>
			<skill id="1201" level="6" cost="390" name="Dryad Root" min_level="30"/>
			<skill id="1201" level="7" cost="770" name="Dryad Root" min_level="35"/>
			<skill id="1201" level="8" cost="770" name="Dryad Root" min_level="35"/>
			<skill id="1201" level="9" cost="770" name="Dryad Root" min_level="35"/>
			<skill id="1204" level="1" cost="330" name="Wind Walk" min_level="20"/>
			<skill id="1204" level="2" cost="1200" name="Wind Walk" min_level="30"/>
			<skill id="1206" level="2" cost="330" name="Wind Shackle" min_level="20"/>
			<skill id="1206" level="3" cost="650" name="Wind Shackle" min_level="25"/>
			<skill id="1206" level="4" cost="1200" name="Wind Shackle" min_level="30"/>
			<skill id="1206" level="5" cost="2300" name="Wind Shackle" min_level="35"/>
			<skill id="1268" level="1" cost="1200" name="Vampiric Rage" min_level="30"/>
		</class>
	</normal_skill_tree>
</list>