<?xml version="1.0" encoding="utf-8"?>
<!DOCTYPE list SYSTEM "tree.dtd">
<!--Create by VISTALL. Full reworked to Glory of Destruction by Bonux. -->
<list>
	<awake_parent_skill_tree>
		<awake_class id="161">	<!--Разбойник Одала-->
			<parent_class id="117"> <!--Кладоискатель-->
				<skill id="30" level="37" name="Backstab"/>
				<skill id="36" level="37" name="Spinning Slasher"/>
				<skill id="60" level="1" name="Fake Death"/>
				<skill id="148" level="8" name="Vital Force"/>
				<skill id="190" level="37" name="Fatal Strike"/>
				<skill id="205" level="45" name="Sword/Blunt Weapon Mastery"/>
				<skill id="209" level="45" name="Dagger Mastery"/>
				<skill id="211" level="10" name="Boost HP"/>
				<skill id="212" level="8" name="Fast HP Recovery"/>
				<skill id="216" level="45" name="Polearm Mastery"/>
				<skill id="227" level="50" name="Light Armor Mastery"/>
				<skill id="231" level="50" name="Heavy Armor Mastery"/>
				<skill id="260" level="37" name="Hammer Crush"/>
				<skill id="263" level="37" name="Deadly Blow"/>
				<skill id="328" level="1" name="Wisdom"/>
				<skill id="329" level="1" name="Health"/>
				<skill id="330" level="1" name="Skill Mastery"/>
				<skill id="347" level="1" name="Earthquake"/>
				<skill id="422" level="3" name="Polearm Accuracy"/>
				<skill id="952" level="5" name="Collector's Experience"/>
				<skill id="997" level="25" name="Crushing Strike"/>
				<skill id="998" level="1" name="Blazing Boost"/>
				<skill id="1559" level="3" name="Potential Ability"/>
			</parent_class>
		</awake_class>
	</awake_parent_skill_tree>
</list>