<?xml version="1.0" encoding="utf-8"?>
<!DOCTYPE list SYSTEM "tree.dtd">
<!--Create by VISTALL. Full reworked to Glory of Destruction by Bonux. -->
<list>
	<normal_skill_tree>
		<class id="1"> <!--warrior-->
			<skill id="312" level="1" cost="370" name="Vicious Stance" min_level="20"/>
			<skill id="216" level="1" cost="370" name="Polearm Mastery" min_level="20"/>
			<skill id="227" level="1" cost="190" name="Light Armor Mastery" min_level="20"/>
			<skill id="227" level="2" cost="190" name="Light Armor Mastery" min_level="20"/>
			<skill id="257" level="1" cost="370" name="Sword/Blunt Weapon Mastery" min_level="20"/>
			<skill id="231" level="1" cost="190" name="Heavy Armor Mastery" min_level="20"/>
			<skill id="231" level="2" cost="190" name="Heavy Armor Mastery" min_level="20"/>
			<skill id="245" level="1" cost="120" name="Wild Sweep" min_level="20"/>
			<skill id="245" level="2" cost="120" name="Wild Sweep" min_level="20"/>
			<skill id="245" level="3" cost="120" name="Wild Sweep" min_level="20"/>
			<skill id="78" level="1" cost="370" name="War Cry" min_level="20"/>
			<skill id="255" level="1" cost="120" name="Power Smash" min_level="20"/>
			<skill id="255" level="2" cost="120" name="Power Smash" min_level="20"/>
			<skill id="255" level="3" cost="120" name="Power Smash" min_level="20"/>
			<skill id="100" level="1" cost="120" name="Stun Attack" min_level="20"/>
			<skill id="100" level="2" cost="120" name="Stun Attack" min_level="20"/>
			<skill id="100" level="3" cost="120" name="Stun Attack" min_level="20"/>
			<skill id="211" level="1" cost="370" name="Boost HP" min_level="20"/>
			<skill id="312" level="2" cost="640" name="Vicious Stance" min_level="24"/>
			<skill id="212" level="1" cost="640" name="Fast HP Recovery" min_level="24"/>
			<skill id="216" level="2" cost="640" name="Polearm Mastery" min_level="24"/>
			<skill id="227" level="3" cost="320" name="Light Armor Mastery" min_level="24"/>
			<skill id="227" level="4" cost="320" name="Light Armor Mastery" min_level="24"/>
			<skill id="257" level="2" cost="640" name="Sword/Blunt Weapon Mastery" min_level="24"/>
			<skill id="231" level="3" cost="320" name="Heavy Armor Mastery" min_level="24"/>
			<skill id="231" level="4" cost="320" name="Heavy Armor Mastery" min_level="24"/>
			<skill id="245" level="4" cost="210" name="Wild Sweep" min_level="24"/>
			<skill id="245" level="5" cost="210" name="Wild Sweep" min_level="24"/>
			<skill id="245" level="6" cost="210" name="Wild Sweep" min_level="24"/>
			<skill id="148" level="1" cost="640" name="Vital Force" min_level="24"/>
			<skill id="255" level="4" cost="210" name="Power Smash" min_level="24"/>
			<skill id="255" level="5" cost="210" name="Power Smash" min_level="24"/>
			<skill id="255" level="6" cost="210" name="Power Smash" min_level="24"/>
			<skill id="100" level="4" cost="210" name="Stun Attack" min_level="24"/>
			<skill id="100" level="5" cost="210" name="Stun Attack" min_level="24"/>
			<skill id="100" level="6" cost="210" name="Stun Attack" min_level="24"/>
			<skill id="256" level="1" cost="640" name="Accuracy" min_level="24"/>
			<skill id="312" level="3" cost="1200" name="Vicious Stance" min_level="28"/>
			<skill id="121" level="1" cost="1200" name="Battle Roar" min_level="28"/>
			<skill id="216" level="3" cost="600" name="Polearm Mastery" min_level="28"/>
			<skill id="216" level="4" cost="600" name="Polearm Mastery" min_level="28"/>
			<skill id="227" level="5" cost="400" name="Light Armor Mastery" min_level="28"/>
			<skill id="227" level="6" cost="400" name="Light Armor Mastery" min_level="28"/>
			<skill id="227" level="7" cost="400" name="Light Armor Mastery" min_level="28"/>
			<skill id="257" level="3" cost="600" name="Sword/Blunt Weapon Mastery" min_level="28"/>
			<skill id="257" level="4" cost="600" name="Sword/Blunt Weapon Mastery" min_level="28"/>
			<skill id="231" level="5" cost="400" name="Heavy Armor Mastery" min_level="28"/>
			<skill id="231" level="6" cost="400" name="Heavy Armor Mastery" min_level="28"/>
			<skill id="231" level="7" cost="400" name="Heavy Armor Mastery" min_level="28"/>
			<skill id="245" level="7" cost="400" name="Wild Sweep" min_level="28"/>
			<skill id="245" level="8" cost="400" name="Wild Sweep" min_level="28"/>
			<skill id="245" level="9" cost="400" name="Wild Sweep" min_level="28"/>
			<skill id="255" level="7" cost="400" name="Power Smash" min_level="28"/>
			<skill id="255" level="8" cost="400" name="Power Smash" min_level="28"/>
			<skill id="255" level="9" cost="400" name="Power Smash" min_level="28"/>
			<skill id="100" level="7" cost="400" name="Stun Attack" min_level="28"/>
			<skill id="100" level="8" cost="400" name="Stun Attack" min_level="28"/>
			<skill id="100" level="9" cost="400" name="Stun Attack" min_level="28"/>
			<skill id="211" level="2" cost="1200" name="Boost HP" min_level="28"/>
			<skill id="312" level="4" cost="1800" name="Vicious Stance" min_level="32"/>
			<skill id="212" level="2" cost="1800" name="Fast HP Recovery" min_level="32"/>
			<skill id="216" level="5" cost="910" name="Polearm Mastery" min_level="32"/>
			<skill id="216" level="6" cost="910" name="Polearm Mastery" min_level="32"/>
			<skill id="227" level="8" cost="610" name="Light Armor Mastery" min_level="32"/>
			<skill id="227" level="9" cost="610" name="Light Armor Mastery" min_level="32"/>
			<skill id="227" level="10" cost="610" name="Light Armor Mastery" min_level="32"/>
			<skill id="257" level="5" cost="910" name="Sword/Blunt Weapon Mastery" min_level="32"/>
			<skill id="257" level="6" cost="910" name="Sword/Blunt Weapon Mastery" min_level="32"/>
			<skill id="231" level="8" cost="610" name="Heavy Armor Mastery" min_level="32"/>
			<skill id="231" level="9" cost="610" name="Heavy Armor Mastery" min_level="32"/>
			<skill id="231" level="10" cost="610" name="Heavy Armor Mastery" min_level="32"/>
			<skill id="245" level="10" cost="610" name="Wild Sweep" min_level="32"/>
			<skill id="245" level="11" cost="610" name="Wild Sweep" min_level="32"/>
			<skill id="245" level="12" cost="610" name="Wild Sweep" min_level="32"/>
			<skill id="148" level="2" cost="1800" name="Vital Force" min_level="32"/>
			<skill id="255" level="10" cost="610" name="Power Smash" min_level="32"/>
			<skill id="255" level="11" cost="610" name="Power Smash" min_level="32"/>
			<skill id="255" level="12" cost="610" name="Power Smash" min_level="32"/>
			<skill id="75" level="1" cost="1800" name="Detect Insect Weakness" min_level="32"/>
			<skill id="100" level="10" cost="610" name="Stun Attack" min_level="32"/>
			<skill id="100" level="11" cost="610" name="Stun Attack" min_level="32"/>
			<skill id="100" level="12" cost="610" name="Stun Attack" min_level="32"/>
			<skill id="312" level="5" cost="3100" name="Vicious Stance" min_level="36"/>
			<skill id="216" level="7" cost="1600" name="Polearm Mastery" min_level="36"/>
			<skill id="216" level="8" cost="1600" name="Polearm Mastery" min_level="36"/>
			<skill id="227" level="11" cost="1000" name="Light Armor Mastery" min_level="36"/>
			<skill id="227" level="12" cost="1000" name="Light Armor Mastery" min_level="36"/>
			<skill id="227" level="13" cost="1000" name="Light Armor Mastery" min_level="36"/>
			<skill id="257" level="7" cost="1600" name="Sword/Blunt Weapon Mastery" min_level="36"/>
			<skill id="257" level="8" cost="1600" name="Sword/Blunt Weapon Mastery" min_level="36"/>
			<skill id="231" level="11" cost="1000" name="Heavy Armor Mastery" min_level="36"/>
			<skill id="231" level="12" cost="1000" name="Heavy Armor Mastery" min_level="36"/>
			<skill id="231" level="13" cost="1000" name="Heavy Armor Mastery" min_level="36"/>
			<skill id="245" level="13" cost="1000" name="Wild Sweep" min_level="36"/>
			<skill id="245" level="14" cost="1000" name="Wild Sweep" min_level="36"/>
			<skill id="245" level="15" cost="1000" name="Wild Sweep" min_level="36"/>
			<skill id="287" level="1" cost="3100" name="Lionheart" min_level="36"/>
			<skill id="255" level="13" cost="1000" name="Power Smash" min_level="36"/>
			<skill id="255" level="14" cost="1000" name="Power Smash" min_level="36"/>
			<skill id="255" level="15" cost="1000" name="Power Smash" min_level="36"/>
			<skill id="100" level="13" cost="1000" name="Stun Attack" min_level="36"/>
			<skill id="100" level="14" cost="1000" name="Stun Attack" min_level="36"/>
			<skill id="100" level="15" cost="1000" name="Stun Attack" min_level="36"/>
			<skill id="211" level="3" cost="3100" name="Boost HP" min_level="36"/>
		</class>
	</normal_skill_tree>
</list>