<?xml version="1.0" encoding="utf-8"?>
<!DOCTYPE list SYSTEM "tree.dtd">
<!--Create by VISTALL. Full reworked to Glory of Destruction by Bonux. -->
<list>
	<awake_parent_skill_tree>
		<awake_class id="179">	<!--Целитель Альгиза-->
			<parent_class id="97"> <!--Кардинал-->		
				<skill id="146" level="45" name="Anti Magic"/>
				<skill id="164" level="3" name="Quick Recovery"/>
				<skill id="212" level="6" name="Fast HP Recovery"/>
				<skill id="213" level="8" name="Boost Mana"/>
				<skill id="228" level="3" name="Fast Spell Casting"/>
				<skill id="229" level="7" name="Fast Mana Recovery"/>
				<skill id="235" level="41" name="Robe Mastery"/>
				<skill id="249" level="42" name="Weapon Mastery"/>
				<skill id="328" level="1" name="Wisdom"/>
				<skill id="329" level="1" name="Health"/>
				<skill id="436" level="1" name="Divine Lore"/>
				<skill id="926" level="1" name="Sigil Mastery"/>
				<skill id="1012" level="3" name="Cure Poison"/>
				<skill id="1016" level="9" name="Resurrection"/>
				<skill id="1028" level="19" name="Might of Heaven"/>
				<skill id="1034" level="13" name="Repose"/>
				<skill id="1042" level="12" name="Hold Undead"/>
				<skill id="1069" level="42" name="Sleep"/>
				<skill id="1075" level="15" name="Peace"/>
				<skill id="1217" level="33" name="Greater Heal"/>
				<skill id="1218" level="33" name="Greater Battle Heal"/>
				<skill id="1219" level="33" name="Greater Group Heal"/>
				<skill id="1254" level="6" name="Mass Resurrection"/>
				<skill id="1271" level="1" name="Benediction"/>
				<skill id="1311" level="6" name="Body of Avatar"/>
				<skill id="1335" level="1" name="Balance Life"/>
				<skill id="1353" level="1" name="Holy Attack Resistance"/>
				<skill id="1360" level="1" name="Mass Block Shield"/>
				<skill id="1361" level="1" name="Mass Block Wind Walk"/>
				<skill id="1394" level="10" name="Trance"/>
				<skill id="1395" level="10" name="Erase"/>
				<skill id="1396" level="10" name="Magical Backfire"/>
				<skill id="1401" level="11" name="Major Heal"/>
				<skill id="1402" level="5" name="Major Group Heal"/>
				<skill id="1409" level="1" name="Cleanse"/>
				<skill id="1410" level="1" name="Salvation"/>
				<skill id="1418" level="1" name="Celestial Shield"/>
				<skill id="1430" level="5" name="Invocation"/>
				<skill id="1459" level="1" name="Divine Power"/>
				<skill id="1524" level="13" name="Surrender to Holy"/>
				<skill id="1553" level="1" name="Chain Heal"/>
			</parent_class>
		</awake_class>
	</awake_parent_skill_tree>
</list>