<?xml version="1.0" encoding="utf-8"?>
<!DOCTYPE list SYSTEM "tree.dtd">
<!--Create by VISTALL. Full reworked to Glory of Destruction by Bonux. -->
<list>
	<normal_skill_tree>
		<class id="49"> <!--orc_mage-->
			<skill id="194" level="1" name="Lucky" min_level="1"/>
			<skill id="214" level="1" name="Mana Recovery" min_level="1"/>
			<skill id="118" level="1" name="Magician's Movement" min_level="1"/>
			<skill id="163" level="1" name="Spellcraft" min_level="1"/>
			<skill id="1001" level="1" name="Soul Cry" min_level="1"/>
			<skill id="1322" level="1" name="Common Craft" min_level="1"/>
			<skill id="134" level="1" name="Toughness" min_level="1"/>
			<skill id="1320" level="1" name="Create Common Item" min_level="5"/>
			<skill id="146" level="1" cost="26" name="Anti Magic" min_level="7"/>
			<skill id="146" level="2" cost="26" name="Anti Magic" min_level="7"/>
			<skill id="252" level="1" cost="26" name="Light Armor Mastery" min_level="7"/>
			<skill id="252" level="2" cost="26" name="Light Armor Mastery" min_level="7"/>
			<skill id="251" level="1" cost="26" name="Robe Mastery" min_level="7"/>
			<skill id="251" level="2" cost="26" name="Robe Mastery" min_level="7"/>
			<skill id="250" level="1" cost="52" name="Weapon Mastery" min_level="7"/>
			<skill id="1090" level="1" cost="52" name="Life Drain" min_level="7"/>
			<skill id="1100" level="1" cost="52" name="Chill Flame" min_level="7"/>
			<skill id="1095" level="1" cost="52" name="Venom" min_level="7"/>
			<skill id="1097" level="1" cost="52" name="Dreaming Spirit" min_level="7"/>
			<skill id="1010" level="1" cost="52" name="Soul Shield" min_level="7"/>
			<skill id="146" level="3" cost="88" name="Anti Magic" min_level="14"/>
			<skill id="146" level="4" cost="88" name="Anti Magic" min_level="14"/>
			<skill id="252" level="3" cost="88" name="Light Armor Mastery" min_level="14"/>
			<skill id="252" level="4" cost="88" name="Light Armor Mastery" min_level="14"/>
			<skill id="251" level="3" cost="88" name="Robe Mastery" min_level="14"/>
			<skill id="251" level="4" cost="88" name="Robe Mastery" min_level="14"/>
			<skill id="250" level="2" cost="180" name="Weapon Mastery" min_level="14"/>
			<skill id="253" level="1" cost="88" name="Heavy Armor Mastery" min_level="14"/>
			<skill id="253" level="2" cost="88" name="Heavy Armor Mastery" min_level="14"/>
			<skill id="1090" level="2" cost="180" name="Life Drain" min_level="14"/>
			<skill id="1001" level="2" cost="180" name="Soul Cry" min_level="14"/>
			<skill id="1007" level="1" cost="180" name="Chant of Battle" min_level="14"/>
			<skill id="1100" level="2" cost="180" name="Chill Flame" min_level="14"/>
			<skill id="1095" level="2" cost="180" name="Venom" min_level="14"/>
			<skill id="1097" level="2" cost="180" name="Dreaming Spirit" min_level="14"/>
			<skill id="1092" level="1" cost="180" name="Fear" min_level="14"/>
			<!--HARDCODED: <skill id="239"level="1" name="Expertise D" min_level="20"/>-->
			<skill id="1320" level="2" name="Create Common Item" min_level="20"/>
			<skill id="1320" level="3" name="Create Common Item" min_level="28"/>
			<skill id="1320" level="4" name="Create Common Item" min_level="36"/>
			<!--HARDCODED: <skill id="239"level="2" name="Expertise C" min_level="40"/>-->
			<skill id="1320" level="5" name="Create Common Item" min_level="43"/>
			<skill id="1320" level="6" name="Create Common Item" min_level="49"/>
			<!--HARDCODED: <skill id="239"level="3" name="Expertise B" min_level="52"/>-->
			<skill id="1320" level="7" name="Create Common Item" min_level="55"/>
			<!--HARDCODED: <skill id="239"level="4" name="Expertise A" min_level="61"/>-->
			<skill id="1320" level="8" name="Create Common Item" min_level="62"/>
			<skill id="1320" level="9" name="Create Common Item" min_level="70"/>
			<!--HARDCODED: <skill id="239"level="5" name="Expertise S" min_level="76"/>-->
			<!--HARDCODED: <skill id="239"level="6" name="Expertise S80" min_level="80"/>-->
			<!--HARDCODED: <skill id="239"level="8" name="Expertise R" min_level="85"/>-->
			<!--HARDCODED: <skill id="239"level="9" name="Expertise R95" min_level="95"/>-->
			<!--HARDCODED: <skill id="239"level="10" name="Expertise R99" min_level="99"/>-->
		</class>
	</normal_skill_tree>
</list>