<?xml version="1.0" encoding="utf-8"?>
<!DOCTYPE list SYSTEM "tree.dtd">
<!--Create by VISTALL. Full reworked to Glory of Destruction by Bonux. -->
<list>
	<normal_skill_tree>
		<class id="31"> <!--dark_fighter-->
			<skill id="194" level="1" name="Lucky" min_level="1"/>
			<skill id="1322" level="1" name="Common Craft" min_level="1"/>
			<skill id="91" level="1" cost="16" name="Defense Aura" min_level="5"/>
			<skill id="142" level="1" cost="16" name="Armor Mastery" min_level="5"/>
			<skill id="141" level="1" cost="16" name="Weapon Mastery" min_level="5"/>
			<skill id="56" level="1" cost="5" name="Power Shot" min_level="5"/>
			<skill id="56" level="2" cost="5" name="Power Shot" min_level="5"/>
			<skill id="56" level="3" cost="5" name="Power Shot" min_level="5"/>
			<skill id="3" level="1" cost="5" name="Power Strike" min_level="5"/>
			<skill id="3" level="2" cost="5" name="Power Strike" min_level="5"/>
			<skill id="3" level="3" cost="5" name="Power Strike" min_level="5"/>
			<skill id="16" level="1" cost="5" name="Mortal Blow" min_level="5"/>
			<skill id="16" level="2" cost="5" name="Mortal Blow" min_level="5"/>
			<skill id="16" level="3" cost="5" name="Mortal Blow" min_level="5"/>
			<skill id="1320" level="1" name="Create Common Item" min_level="5"/>
			<skill id="77" level="1" cost="91" name="Attack Aura" min_level="10"/>
			<skill id="142" level="2" cost="46" name="Armor Mastery" min_level="10"/>
			<skill id="142" level="3" cost="46" name="Armor Mastery" min_level="10"/>
			<skill id="141" level="2" cost="91" name="Weapon Mastery" min_level="10"/>
			<skill id="56" level="4" cost="31" name="Power Shot" min_level="10"/>
			<skill id="56" level="5" cost="31" name="Power Shot" min_level="10"/>
			<skill id="56" level="6" cost="31" name="Power Shot" min_level="10"/>
			<skill id="3" level="4" cost="31" name="Power Strike" min_level="10"/>
			<skill id="3" level="5" cost="31" name="Power Strike" min_level="10"/>
			<skill id="3" level="6" cost="31" name="Power Strike" min_level="10"/>
			<skill id="16" level="4" cost="31" name="Mortal Blow" min_level="10"/>
			<skill id="16" level="5" cost="31" name="Mortal Blow" min_level="10"/>
			<skill id="16" level="6" cost="31" name="Mortal Blow" min_level="10"/>
			<skill id="142" level="4" cost="140" name="Armor Mastery" min_level="15"/>
			<skill id="142" level="5" cost="140" name="Armor Mastery" min_level="15"/>
			<skill id="141" level="3" cost="290" name="Weapon Mastery" min_level="15"/>
			<skill id="70" level="1" cost="140" name="Drain Health" min_level="15"/>
			<skill id="70" level="2" cost="140" name="Drain Health" min_level="15"/>
			<skill id="56" level="7" cost="95" name="Power Shot" min_level="15"/>
			<skill id="56" level="8" cost="95" name="Power Shot" min_level="15"/>
			<skill id="56" level="9" cost="95" name="Power Shot" min_level="15"/>
			<skill id="3" level="7" cost="95" name="Power Strike" min_level="15"/>
			<skill id="3" level="8" cost="95" name="Power Strike" min_level="15"/>
			<skill id="3" level="9" cost="95" name="Power Strike" min_level="15"/>
			<skill id="294" level="1" cost="290" name="Shadow Sense" min_level="15"/>
			<skill id="16" level="7" cost="95" name="Mortal Blow" min_level="15"/>
			<skill id="16" level="8" cost="95" name="Mortal Blow" min_level="15"/>
			<skill id="16" level="9" cost="95" name="Mortal Blow" min_level="15"/>
			<!--HARDCODED: <skill id="239"level="1" name="Expertise D" min_level="20"/>-->
			<skill id="1320" level="2" name="Create Common Item" min_level="20"/>
			<skill id="1320" level="3" name="Create Common Item" min_level="28"/>
			<skill id="1320" level="4" name="Create Common Item" min_level="36"/>
			<!--HARDCODED: <skill id="239"level="2" name="Expertise C" min_level="40"/>-->
			<skill id="1320" level="5" name="Create Common Item" min_level="43"/>
			<skill id="1320" level="6" name="Create Common Item" min_level="49"/>
			<!--HARDCODED: <skill id="239"level="3" name="Expertise B" min_level="52"/>-->
			<skill id="1320" level="7" name="Create Common Item" min_level="55"/>
			<!--HARDCODED: <skill id="239"level="4" name="Expertise A" min_level="61"/>-->
			<skill id="1320" level="8" name="Create Common Item" min_level="62"/>
			<skill id="1320" level="9" name="Create Common Item" min_level="70"/>
			<!--HARDCODED: <skill id="239"level="5" name="Expertise S" min_level="76"/>-->
			<!--HARDCODED: <skill id="239"level="6" name="Expertise S80" min_level="80"/>-->
			<!--HARDCODED: <skill id="239"level="8" name="Expertise R" min_level="85"/>-->
			<!--HARDCODED: <skill id="239"level="9" name="Expertise R95" min_level="95"/>-->
			<!--HARDCODED: <skill id="239"level="10" name="Expertise R99" min_level="99"/>-->
		</class>
	</normal_skill_tree>
</list>