<?xml version="1.0" encoding="utf-8"?>
<!DOCTYPE list SYSTEM "tree.dtd">
<!--Create by VISTALL. Full reworked to Glory of Destruction by Bonux. -->
<list>
	<normal_skill_tree>
		<class id="25"> <!--elven_mage-->
			<skill id="194" level="1" name="Lucky" min_level="1"/>
			<skill id="214" level="1" name="Mana Recovery" min_level="1"/>
			<skill id="118" level="1" name="Magician's Movement" min_level="1"/>
			<skill id="163" level="1" name="Spellcraft" min_level="1"/>
			<skill id="1322" level="1" name="Common Craft" min_level="1"/>
			<skill id="1216" level="1" name="Self Heal" min_level="1"/>
			<skill id="1177" level="1" name="Wind Strike" min_level="1"/>
			<skill id="1320" level="1" name="Create Common Item" min_level="5"/>
			<skill id="146" level="1" cost="26" name="Anti Magic" min_level="7"/>
			<skill id="146" level="2" cost="26" name="Anti Magic" min_level="7"/>
			<skill id="244" level="1" cost="52" name="Armor Mastery" min_level="7"/>
			<skill id="249" level="1" cost="52" name="Weapon Mastery" min_level="7"/>
			<skill id="1012" level="1" cost="52" name="Cure Poison" min_level="7"/>
			<skill id="1184" level="1" cost="26" name="Ice Bolt" min_level="7"/>
			<skill id="1184" level="2" cost="26" name="Ice Bolt" min_level="7"/>
			<skill id="1011" level="1" cost="17" name="Heal" min_level="7"/>
			<skill id="1011" level="2" cost="17" name="Heal" min_level="7"/>
			<skill id="1011" level="3" cost="17" name="Heal" min_level="7"/>
			<skill id="1068" level="1" cost="52" name="Might" min_level="7"/>
			<skill id="1177" level="2" cost="26" name="Wind Strike" min_level="7"/>
			<skill id="1177" level="3" cost="26" name="Wind Strike" min_level="7"/>
			<skill id="1040" level="1" cost="52" name="Shield" min_level="7"/>
			<skill id="146" level="3" cost="110" name="Anti Magic" min_level="14"/>
			<skill id="146" level="4" cost="110" name="Anti Magic" min_level="14"/>
			<skill id="1015" level="1" cost="70" name="Battle Heal" min_level="14"/>
			<skill id="1015" level="2" cost="70" name="Battle Heal" min_level="14"/>
			<skill id="1015" level="3" cost="70" name="Battle Heal" min_level="14"/>
			<skill id="244" level="2" cost="110" name="Armor Mastery" min_level="14"/>
			<skill id="244" level="3" cost="110" name="Armor Mastery" min_level="14"/>
			<skill id="249" level="2" cost="210" name="Weapon Mastery" min_level="14"/>
			<skill id="1027" level="1" cost="70" name="Group Heal" min_level="14"/>
			<skill id="1027" level="2" cost="70" name="Group Heal" min_level="14"/>
			<skill id="1027" level="3" cost="70" name="Group Heal" min_level="14"/>
			<skill id="1184" level="3" cost="110" name="Ice Bolt" min_level="14"/>
			<skill id="1184" level="4" cost="110" name="Ice Bolt" min_level="14"/>
			<skill id="1011" level="4" cost="70" name="Heal" min_level="14"/>
			<skill id="1011" level="5" cost="70" name="Heal" min_level="14"/>
			<skill id="1011" level="6" cost="70" name="Heal" min_level="14"/>
			<skill id="1206" level="1" cost="210" name="Wind Shackle" min_level="14"/>
			<skill id="1164" level="1" cost="210" name="Curse: Weakness" min_level="14"/>
			<skill id="1177" level="4" cost="110" name="Wind Strike" min_level="14"/>
			<skill id="1177" level="5" cost="110" name="Wind Strike" min_level="14"/>
			<!--HARDCODED: <skill id="239"level="1" name="Expertise D" min_level="20"/>-->
			<skill id="1320" level="2" name="Create Common Item" min_level="20"/>
			<skill id="1320" level="3" name="Create Common Item" min_level="28"/>
			<skill id="1320" level="4" name="Create Common Item" min_level="36"/>
			<!--HARDCODED: <skill id="239"level="2" name="Expertise C" min_level="40"/>-->
			<skill id="1320" level="5" name="Create Common Item" min_level="43"/>
			<skill id="1320" level="6" name="Create Common Item" min_level="49"/>
			<!--HARDCODED: <skill id="239"level="3" name="Expertise B" min_level="52"/>-->
			<skill id="1320" level="7" name="Create Common Item" min_level="55"/>
			<!--HARDCODED: <skill id="239"level="4" name="Expertise A" min_level="61"/>-->
			<skill id="1320" level="8" name="Create Common Item" min_level="62"/>
			<skill id="1320" level="9" name="Create Common Item" min_level="70"/>
			<!--HARDCODED: <skill id="239"level="5" name="Expertise S" min_level="76"/>-->
			<!--HARDCODED: <skill id="239"level="6" name="Expertise S80" min_level="80"/>-->
			<!--HARDCODED: <skill id="239"level="8" name="Expertise R" min_level="85"/>-->
			<!--HARDCODED: <skill id="239"level="9" name="Expertise R95" min_level="95"/>-->
			<!--HARDCODED: <skill id="239"level="10" name="Expertise R99" min_level="99"/>-->
		</class>
	</normal_skill_tree>
</list>